"name","slug","denomination","category","country","city","address","pastor_name","website","phone","email","description","mission_statement","founding_year","member_count","ministry_count","is_church_os_client","is_verified","accepts_donations","donation_url"
"Kanda Catholic Church","kanda-catholic-church-tokyo","Catholic","catholic","Japan","Tokyo","1-1-2 Nishi-Kanda, Chiyoda-ku, Tokyo 101-0065","Fr. Peter","[http://www.catholic-kanda.jp](http://www.catholic-kanda.jp)","+81 3 3261 0525","info@catholic-kanda.jp","One of the oldest Catholic churches in Tokyo, founded in 1874. It is a registered Tangible Cultural Property of Japan and serves as a significant spiritual landmark in the Kanda district.","To proclaim the Gospel and serve the spiritual needs of the city.","1874","1500","6","false","true","true",null
"Japan Evangelical Lutheran Tokyo Church","jelc-tokyo-church-tokyo","Lutheran","non-denominational","Japan","Tokyo","1-2-1 Okubo, Shinjuku-ku, Tokyo 169-0072","Rev. Kenichi Sekino","[http://www.jelc-tokyo.org](http://www.jelc-tokyo.org)","+81 3 3209 5702","office@jelc-tokyo.org","Located in the bustling Shinjuku area, this church is the flagship of the Japan Evangelical Lutheran Church. It features a stunning pipe organ and a strong focus on community music and service.","Saved by Grace through Faith.","1912","800","5","false","true","true","[http://www.jelc-tokyo.org/support](http://www.jelc-tokyo.org/support)"
"Christ Church Yokohama","christ-church-yokohama-yokohama","Anglican","anglican","Japan","Yokohama","235 Yamate-cho, Naka-ku, Yokohama 231-0862","Rev. David Guest","[http://www.christchurchyokohama.org](http://www.christchurchyokohama.org)","+81 45 623 2100","chaplain@christchurchyokohama.org","A historic international Anglican congregation located on the famous Yamate bluff overlooking the harbor. It has served the expatriate and local English-speaking community for over 150 years.","To be a beacon of Christ's love in the port city.","1863","300","4","false","true","true","[http://www.christchurchyokohama.org/giving](http://www.christchurchyokohama.org/giving)"
"Tokyo Central Church","tokyo-central-church-tokyo","Methodist","methodist","Japan","Tokyo","1-13-11 Nishi-Waseda, Shinjuku-ku, Tokyo 169-0051","Rev. Takashi Yamada","[http://www.tokyocentral.org](http://www.tokyocentral.org)","+81 3 3203 2341","info@tokyocentral.org","A central Methodist congregation with a deep focus on social holiness and urban mission in the Shinjuku district. It hosts numerous community programs for seniors and youth.","Leading people into a transformed life in Christ.","1880","1200","8","false","true","true",null
"Asakusa Catholic Church","asakusa-catholic-church-tokyo","Catholic","catholic","Japan","Tokyo","5-20-5 Asakusa, Taito-ku, Tokyo 111-0032","Fr. Joseph","[http://asakusa-catholic.jp](http://asakusa-catholic.jp)","+81 3 3873 4004","office@asakusa-catholic.jp","A historic parish located in the traditional Asakusa district, dedicated to the North American Martyrs. It serves a diverse population including many migrant families.","Worshipping together in the heart of old Tokyo.","1877","700","4","false","true","true",null
"Takanawa Catholic Church","takanawa-catholic-church-tokyo","Catholic","catholic","Japan","Tokyo","4-7-1 Takanawa, Minato-ku, Tokyo 108-0074","Fr. Michael","[http://takanawa-catholic.org](http://takanawa-catholic.org)","+81 3 3441 5556","info@takanawa-catholic.org","Known for its monument to the Edo Martyrs, this church commemorates the history of faith in Japan. It is located near Shinagawa Station and has a large, active community.","Commemorating the martyrs, living for Christ.","1959","1000","5","false","true","true",null
"Koenji Catholic Church","koenji-catholic-church-tokyo","Catholic","catholic","Japan","Tokyo","2-33-12 Koenjikita, Suginami-ku, Tokyo 166-0002","Fr. Simon","[http://koenji-catholic.jp](http://koenji-catholic.jp)","+81 3 3337 5051","office@koenji-catholic.jp","A welcoming community in the Suginami area known for its vibrant parish life and support for local refugees. It hosts various international cultural exchange events.","Walking together in faith and love.","1928","1200","6","false","true","true",null
"Den-en-chofu Catholic Church","den-en-chofu-catholic-church-tokyo","Catholic","catholic","Japan","Tokyo","3-11-3 Den-en-chofu, Ota-ku, Tokyo 145-0071","Fr. Peter","[http://catholic-denenchofu.jp](http://catholic-denenchofu.jp)","+81 3 3721 2750","info@catholic-denenchofu.jp","A beautiful Franciscan parish in the Den-en-chofu residential area, featuring a traditional garden and architecture. It is known for its quiet, prayerful atmosphere.","Peace and Goodness.","1932","2000","7","false","true","true",null
"Shibuya Evangelical Church","shibuya-evangelical-church-tokyo","Evangelical","evangelical","Japan","Tokyo","1-20-17 Shibuya, Shibuya-ku, Tokyo 150-0002","Pastor Ken Tanaka","[http://shibuya-church.jp](http://shibuya-church.jp)","+81 3 3407 1234","info@shibuya-church.jp","An evangelical congregation located in the heart of Shibuya, focusing on outreach to students and young professionals. It emphasizes personal discipleship and Bible study.","Bringing the light of the Gospel to the city center.","1950","400","4","false","true","true","[http://shibuya-church.jp/give](http://shibuya-church.jp/give)"
"Osaka Central Church","osaka-central-church-osaka","Methodist","methodist","Japan","Osaka","1-11-23 Itachibori, Nishi-ku, Osaka 550-0012","Rev. Hiroshi Sato","[http://osaka-central.org](http://osaka-central.org)","+81 6 6531 3341","info@osaka-central.org","A primary United Church of Christ in Japan (UCCJ) congregation in Osaka, with a long history of social activism and welfare programs. It remains a key hub for Protestantism in the Kansai region.","Serving Osaka with the love of Christ.","1874","800","6","false","true","true",null
"Tamatsukuri Catholic Cathedral","tamatsukuri-catholic-cathedral-osaka","Catholic","catholic","Japan","Osaka","2-2-22 Tamatsukuri, Chuo-ku, Osaka 540-0004","Fr. Michael","[https://osaka-cathedral.jp](https://osaka-cathedral.jp)","+81 6 6941 2332","info@osaka-cathedral.jp","Also known as St. Mary's Cathedral of Osaka, it is the seat of the Archdiocese. The church is famous for its pipe organ and beautiful modernist architecture.","To be the spiritual heart of the Osaka Archdiocese.","1894","3500","10","false","true","true",null
"Toyonaka Catholic Church","toyonaka-catholic-church-osaka","Catholic","catholic","Japan","Osaka","1-1-1 Suehiro-cho, Toyonaka-shi, Osaka 561-0817","Fr. Andrew","[http://toyonaka-catholic.org](http://toyonaka-catholic.org)","+81 6 6331 1607","office@toyonaka-catholic.org","A thriving parish in the northern suburbs of Osaka, known for its strong Sunday School and family-oriented ministries. It serves as a community center for the local residential area.","Building a family of faith in Toyonaka.","1935","1500","6","false","true","true",null
"Kyoto Resurrection Church","kyoto-resurrection-church-kyoto","Anglican","anglican","Japan","Kyoto","Horikawa-dori, Nakagyo-ku, Kyoto, Japan","Rev. Luke","[http://kyoto-nskk.jp/fukkatsu](http://kyoto-nskk.jp/fukkatsu)","+81 75 000 0000","info@kyoto-nskk.jp","A central Anglican parish in Kyoto with a focus on liturgy and traditional Japanese Christian expression. It is part of the Diocese of Kyoto (NSKK).","Witnessing to the Resurrection in the ancient capital.","1920","400","4","false","true","true",null
"Nara Christ Church","nara-christ-church-nara","Anglican","anglican","Japan","Nara","60 Noborioji-cho, Nara 630-8213","Rev. Timothy","[http://www.nskk.org/nara/christ](http://www.nskk.org/nara/christ)","+81 742 22 2341","info@nara-nskk.jp","A historic Anglican church located near the famous Nara Park. The building is a registered Tangible Cultural Property and combines Western and Japanese architectural elements.","Peace in the heart of Nara.","1887","300","3","false","true","true",null
"Nagoya All Saints Church","nagoya-all-saints-church-nagoya","Anglican","anglican","Japan","Nagoya","2-17-21 Shirakabe, Higashi-ku, Nagoya 461-0011","Rev. Francis","[http://www.nagoya-nskk.jp/all-saints](http://www.nagoya-nskk.jp/all-saints)","+81 52 931 3541","office@nagoya-nskk.jp","The primary Anglican presence in Nagoya, focusing on traditional worship and community outreach. It is known for its beautiful brick facade and historic pipe organ.","All are welcome in the name of the Lord.","1889","500","5","false","true","true",null
"Sendai Orthodox Church","sendai-orthodox-church-sendai","Orthodox","orthodox","Japan","Sendai","1-3-1 Kitamachi, Aoba-ku, Sendai 980-0011","Fr. Nikolay","[http://sendai-orthodox.jp](http://sendai-orthodox.jp)","+81 22 222 5507","info@sendai-orthodox.jp","The Church of the Annunciation serves the Orthodox community in Northern Japan. Rebuilt after historical fires, it remains a center for Byzantine liturgy and spiritual life in Tohoku.","Proclaiming the eternal truth of Orthodoxy.","1872","400","4","false","true","true",null
"Nagoya Orthodox Church","nagoya-orthodox-church-nagoya","Orthodox","orthodox","Japan","Nagoya","2-18-4 Yamawaki-cho, Showa-ku, Nagoya 466-0062","Fr. Paul","[http://nagoya-orthodox.jp](http://nagoya-orthodox.jp)","+81 52 731 3452","contact@nagoya-orthodox.jp","The Church of the Epiphany is a serene place of worship in Nagoya, featuring traditional iconography and a dedicated choir for Byzantine chant.","Illumination through the Holy Spirit.","1913","300","3","false","true","true",null
"Osaka Orthodox Church","osaka-orthodox-church-osaka","Orthodox","orthodox","Japan","Osaka","1-10-18 Awaza, Nishi-ku, Osaka 550-0011","Fr. Sergey","[http://osaka-orthodox.jp](http://osaka-orthodox.jp)","+81 6 6531 3687","office@osaka-orthodox.jp","A focal point for Orthodox Christianity in the Kansai region, this church provides regular services in Japanese and Russian. It is known for its resilient community.","Witnessing the ancient faith in modern Osaka.","1878","500","5","false","true","true",null
"Kyoto Orthodox Church","kyoto-orthodox-church-kyoto","Orthodox","orthodox","Japan","Kyoto","Yanagibaba Higashino-cho, Nakagyo-ku, Kyoto 604-0951","Fr. John","[http://kyoto-orthodox.jp](http://kyoto-orthodox.jp)","+81 75 231 2438","info@kyoto-orthodox.jp","The Church of the Holy Resurrection in Kyoto is the oldest Orthodox church building in Japan. Its design follows traditional Russian Orthodox architecture with a Japanese touch.","Ancient faith in an ancient city.","1889","250","3","false","true","true",null
"Toyohashi Orthodox Church","toyohashi-orthodox-church-toyohashi","Orthodox","orthodox","Japan","Toyohashi","3-2 Hatchodori, Toyohashi, Aichi 440-0806","Fr. Andrew","[http://toyohashi-orthodox.jp](http://toyohashi-orthodox.jp)","+81 532 52 3594","info@toyohashi-orthodox.jp","A designated Important Cultural Property of Japan, this church is famous for its intricate wood carvings and early icons by Yamashita Rin.","Faith preserved in stone and wood.","1913","200","2","false","true","true",null
"Shizuoka Orthodox Church","shizuoka-orthodox-church-shizuoka","Orthodox","orthodox","Japan","Shizuoka","3-4 Kasuga, Aoi-ku, Shizuoka 420-0823","Fr. Mark","[http://shizuoka-orthodox.jp](http://shizuoka-orthodox.jp)","+81 54 252 3341","office@shizuoka-orthodox.jp","A local Orthodox community serving the Shizuoka region with regular liturgical services and community study groups.","Searching for Truth in Shizuoka.","1890","150","2","false","true","true",null
"Yokohama Orthodox Church","yokohama-orthodox-church-yokohama","Orthodox","orthodox","Japan","Yokohama","203 Yamate-cho, Naka-ku, Yokohama 231-0862","Fr. Peter","[http://yokohama-orthodox.jp](http://yokohama-orthodox.jp)","+44 1474 532134","info@yokohama-orthodox.jp","Located on the historic Yamate hill, this church serves the Orthodox residents of Yokohama and the greater Kanagawa area. It has strong ties to the early mission history.","Bearing witness to the harbor of souls.","1874","400","4","false","true","true",null
"Tokyo Musashino Church","tokyo-musashino-church-tokyo","Non-Denominational","non-denominational","Japan","Tokyo","2-3-22 Sakai, Musashino-shi, Tokyo 180-0022","Rev. Akira Suzuki","[http://www.musashino-church.com](http://www.musashino-church.com)","+81 422 51 3456","office@musashino-church.org","A vibrant United Church of Christ in Japan (UCCJ) congregation in Western Tokyo, known for its focus on social justice, environmental stewardship, and community welfare.","A community of faith serving the Musashino region.","1947","600","5","false","true","true",null
"Akita Seitai Hoshikai","akita-seitai-hoshikai-akita","Catholic","catholic","Japan","Akita","Soegawa Yuzawa-dai 1, Akita 010-0822","Fr. Rector","[http://seitaihoshikai.com](http://seitaihoshikai.com)","+81 18 868 2139","info@seitaihoshikai.com","Also known as Our Lady of Akita, this convent and chapel is a major pilgrimage site famous for the reported weeping of a statue of Mary. It focuses on prayer and penance.","Praying for the world in the spirit of Akita.","1973","500","4","false","true","true",null
"Shimonoseki Catholic Church","shimonoseki-catholic-church-shimonoseki","Catholic","catholic","Japan","Shimonoseki","4-1-2 Maruyama-cho, Shimonoseki, Yamaguchi 750-0062","Fr. Joseph","[http://shimonoseki-catholic.jp](http://shimonoseki-catholic.jp)","+81 83 231 1664","office@shimonoseki-catholic.jp","A central parish in the port city of Shimonoseki, serving a local and seafaring international community. It is known for its beautiful hilltop location.","Grace at the gates of the Strait.","1948","700","4","false","true","true",null
"Aizu-Wakamatsu Catholic Church","aizu-wakamatsu-catholic-church-aizu-wakamatsu","Catholic","catholic","Japan","Aizu-Wakamatsu","1-41 Sakaemachi, Aizu-Wakamatsu, Fukushima 965-0871","Fr. Bernard","[http://aizu-catholic.jp](http://aizu-catholic.jp)","+81 242 22 2341","info@aizu-catholic.jp","A historic parish in the samurai city of Aizu, focusing on education and local community service in Fukushima prefecture.","Faith and courage in Aizu.","1930","450","3","false","true","true",null
"Takatsuki Catholic Church","takatsuki-catholic-church-takatsuki","Catholic","catholic","Japan","Takatsuki","2-33 Jo-nai-machi, Takatsuki, Osaka 569-0075","Fr. Luke","[http://takatsuki-catholic.org](http://takatsuki-catholic.org)","+81 72 671 2341","info@takatsuki-catholic.org","Located in the city of the Blessed Justo Takayama Ukon, this church is a center for pilgrimage and historical study of the 'Kirishitan' era.","Remembering the Justo, following the Lord.","1952","1200","6","false","true","true",null
"Tottori Catholic Church","tottori-catholic-church-tottori","Catholic","catholic","Japan","Tottori","1-610 Higashimachi, Tottori 680-0011","Fr. Andrew","[http://tottori-catholic.jp](http://tottori-catholic.jp)","+81 857 22 3443","info@tottori-catholic.jp","A small but dedicated community serving the Tottori region on the Sea of Japan coast. It is known for its close-knit family atmosphere.","A small light in the sand dunes.","1955","300","2","false","true","true",null
"Matsumoto Catholic Church","matsumoto-catholic-church-matsumoto","Catholic","catholic","Japan","Matsumoto","3-2-22 Marunouchi, Matsumoto, Nagano 390-0873","Fr. Simon","[http://matsumoto-catholic.jp](http://matsumoto-catholic.jp)","+81 263 32 3687","info@matsumoto.jp","Serving the Matsumoto region near the historic castle, this parish has a strong focus on liturgical arts and social welfare.","Grace in the Alps.","1935","600","4","false","true","true",null
"Nagano Catholic Church","nagano-catholic-church-nagano","Catholic","catholic","Japan","Nagano","1321 Miwa, Nagano-shi 380-0803","Fr. Thomas","[http://nagano-catholic.jp](http://nagano-catholic.jp)","+81 26 232 3687","info@nagano-catholic.jp","The primary Catholic presence in Nagano city, providing a home for diverse local and migrant believers in the mountainous region.","One heart in the Nagano mountains.","1950","800","5","false","true","true",null"
